"DESCRIPTION","DURATION IN MS","NAME","PARENT SUITE","START TIME","STATUS","STOP TIME","SUB SUITE","SUITE","TEST CLASS","TEST METHOD"
"","22","Изъятие анекдота из кривой вёрстки","Парсер сайта AnekdotRu","Fri Oct 03 18:25:19 MSK 2025","passed","Fri Oct 03 18:25:19 MSK 2025","","","",""
"","12","Успешный вход","Вход и регистрация пользователя","Fri Oct 03 18:25:19 MSK 2025","passed","Fri Oct 03 18:25:19 MSK 2025","","","",""
"","22","Корректное изъятие текста анекдота с вёрстки","Парсер сайта AnekdotovStreet","Fri Oct 03 18:25:19 MSK 2025","passed","Fri Oct 03 18:25:19 MSK 2025","","","",""
"","4","Успешная регистрация","Вход и регистрация пользователя","Fri Oct 03 18:25:19 MSK 2025","passed","Fri Oct 03 18:25:19 MSK 2025","","","",""
"","3","Регистрация с занятым логином","Вход и регистрация пользователя","Fri Oct 03 18:25:19 MSK 2025","passed","Fri Oct 03 18:25:19 MSK 2025","","","",""
"","29","Вход с неверным логином","Вход и регистрация пользователя","Fri Oct 03 18:25:19 MSK 2025","passed","Fri Oct 03 18:25:19 MSK 2025","","","",""
"","15","Корректное изъятие текста анекдота с вёрстки","Парсер сайта AnekdotRu","Fri Oct 03 18:25:19 MSK 2025","passed","Fri Oct 03 18:25:19 MSK 2025","","","",""
"","3","Вход с неверным паролем","Вход и регистрация пользователя","Fri Oct 03 18:25:19 MSK 2025","passed","Fri Oct 03 18:25:19 MSK 2025","","","",""
